ID,Course name,Class name,Teacher name,Number of credits,Maximum number of students,Day of week,Session
MTH00030,Dai so tuyen tinh,22CTT2,Nguyen Van A,3,50,Wednesday,S1-7:30
CSC10002,Ky thuat lap trinh,22CTT2,Nguyen Le Hoang Dung,4,50,Tuesday,S1-7:30
BAA00102,Kinh te chinh tri,22HOH2,Nguyen Van Tron,2,50,Friday,S1-7:30
BAA00004,Phap luat dai cuong,22CTT2,Nguyen Thi B,3,50,Tuesday,S3-13:30
MTH00004,Vi tich phan 2B,22CTT2,Nguyen Tien Dat,3,50,Monday,S1-7:30
PHY00001,Vat ly dai cuong 1,22CTT2,Nguyen Thi C,3,50,Friday,S3-13:30
BAA00022,The Duc 2,22BC_T3Ti1,Nguyen Van C,2,50,Tuesday,S2-9:30
